LABEL,text,like,published_month
0, so rx 480 rx 580 new rumored amd gpu c'mon guys spotify already doesn't make money why not why did the v series dump the second screen i still have the v20 non removable battery and dumping the second screen turned me off on the v30 and looks like my trusty 10 800mah capacity wireless charging rigged v20 will live on to see another generation ,0,Sep-18
0, no i would not have predicted noctua making a gpu cooler so i'm very interested to see what it does ,1,Aug-21
1, we now know why there is a worldwide ram and gpu shortage nvidia ram manufacures have pooled their factories to produce the beheamith ,0,Jun-18
0, i mine on the most disliked gpu the radeon vii this should be okay right it's just as fast as a 3080 with 100mh and it was cheap in december 2019 only 450usd ,0,Mar-21
0, i bet someone is going to buy this as a gaming gpu and complain why it cant play 8k games ,0,Nov-20
0, sponsored by msi the scalper of their own rtx cards other channels have boycotted msi and refusing to work with them lmg just lost a subscriber ,0,Oct-20
0, as an full amd system user i have to say nvidia recently has been working hard need those voice filters ,0,Apr-20
2, i did not have any problem buying a rtx 300 series card in my country the local shop had stock of 3060ti and 3070 cards they are however very expensive for most people here though a 3070 cost nearly 2x as much as a 1070 used to go for ,0,Nov-20
1, if you have to sell your soul to the devil for an nvidia gpu what will gingers like me do ,0,Jun-18
0, amd in reality keeping things hidden to make a explosive comeback with a better card than before and also better than nvidiea i don't use it as you can tell ,0,Jul-19
0, i've been wondering when the 710 would get an update but i was thinking a 3010 would come out not 1010 they really don't care about low end gpus i have a 3070 so i am not looking to buy it but i hope they bring out a 3030 or something for some decent gaming performance at 100 bucks for people that don't want need or can get a 3060 or higher ,0,Jan-21
2, i know everybody excited for new rtx 3090 but let's be real most of us can't afford them crying with my gtx 1650 ,0,Aug-20
0, i love how you could use gaugan from a web browser but now you need an rtx gpu to use the full version ,0,Jun-21
2, i keep putting off getting a new graphics card because i keep hoping someone will launch a fast new card in the next few months still rocking a 980 ,0,Apr-20
0, there's a big difference between a freesync monitor also supporting gsync vs gysnc monitor also supporting freesync the latter which is the example on this video you are still still have to pay more money to nvidia for the monitor the only difference now is that nvidia being lesser of an a hole and care less after they got your money and not longer slap on the wrist of new users for daring to switch to amd graphic card despite the user had to pay extra 150 200 for the so called gsync monitor doesn't help any of the existing users to escape the gsync prison shackle they are still in ,0,Nov-19
0, im a computational astrophysicist we use a lot of computing power and what we have is never enough i guarantee you i will never use one of those amd cards because literally everyone who uses any from of gpu accelerated code does so with cuda ,1,Nov-20
1, maybe just maybe they will actually be able to have flipping true msrp on the dang cards and not have them still over priced ,0,Jun-18
1, everyone should buy a gpu pay via cc and threaten to file a chargeback if the asshole seller doesnt let you return the card used for a full refund suppose you buy the card and all of a sudden dont know how to plug it into your pc and need to return it ,0,Sep-20
0, if rtx require dlss to run properly and dlss is fake 4k by upscaling 1440p should it not be considered a single feature rather than two ,0,Feb-19
2, sure why sell those gpus at a reasonable price when you can just keep the supply low and hang onto those crypto inflated gpu prices as long as humanly possible and while they're at it waste a ton of nand which there is allegedly a shortage of that way ram prices can stay insanely high too it's a win win for everyone except for the consumer ,0,Jun-18
0, i think the concern is the acquisition of these new gpus to mass that dont need them and pricing long live the king the king is dead ,0,Sep-18
0, out of stock in the uk unless your willing to pay 450 from nvidia website for a palit or zotac version ,0,Nov-20
0, a lot of people are freaking out over the fact that their shiny new rtx cards are going to become obsolete sure it's only been six months since the cards came out but because of that we really need to ask ourselves just how much of an improvement super will actually be chances are not much you still got what you paid for and if what you paid for was a card to brag to your friends about then money mustn't be a real issue for you ,1,Jun-19
0, the nvidia arm rtx demo also has one cool thing its running on a custom arch linux installation speculations can be true that if there will a new nvidia console shield 2 portable anyone it will be arm based compete directly with steam deck and have rtx support while running on a custom arch linux install super fun times ,2,Jul-21
1, this fucking scalprels and miners are selling gpus for 10319049308148923894238942398498 dollars i just wanted rtx 3070 i collected that many moneh and i cant even do that ,0,Nov-20
0, if thats real rtx images then im sold a reason to buy an rtx card still dungeons in mc need to be updated though the whole cave system ,0,Aug-19
2, well i don't have money for a new card atm anyway so i will wait till 2021 and see what new stuff come out and see if the stock slowly comes back ,0,Nov-20
0, lets hope that nvidia cuts down their price on the 3080ti to compete against amd this is why competition is good you fan boy sheeps you total cancer garbage human beings who have given companies air under their wings to raise the prices beyond stupidity levels ,0,Oct-20
0, yeah no most shader mods look better than rtx on minecraft and they cancelled super duper graphics for this bullshit now we can all live our dream of playing minecraft at 20fps on the most expensive gpu on the market ,38,Aug-19
0, hardware unboxed is amd biased i've been saying that for a while and getting hate for it really not surprising nvidia blacklisted it ,0,Dec-20
1, great so a gpu you can't even buy is going up in price sounds real fair we got a product you want but you cant buy it but if you ever will it used to cost 800 now it cost 1200 because you didnt get one at the very first moment where it was already impossible to posses one ,0,Jan-21
2, bros i'm still using a 4gb 8800gtx i mean i can still play every current gen released game on medium settings like witcher 3 but ffs give me one of those 300 00 at a discount nvidia i need me some beat saber ,3,Jun-18
0, what if there was a customizable graphics card like custom vram amount custom memory and clock speeds custom chassis or maybe an upgradable graphics card you can remove and add vram sticks removable gpu where there are multiple gpus you can add to your graphics card sorry idk why i said all of that p ,1,Jan-21
0, very good clip anthony will nvidia cutting out the scalpers scalping 1200 computex gpu for themselves monopolizing for their own benefit as this only show their business practices roadmap to how they will hold all users of arm products to ransom ,0,May-21
1, last i heard nvidia wasn't going to ramp up production during the mining craze because of this and now that the craze is over this happens what lol ,0,Jun-18
1, gpus are still highly overpriced due to the mining flush the market with these chips and bring them back down to sensible prices ,2,Jun-18
0, msi caught price gouging their rtx30 cards and not even apologizing about it when they got caught never buying msi ever again ,0,Oct-20
1, nvidia doesnt care about consumers they just see an opportunity to sell off old stock with fancy feathers for more just like lmg sees an opertunity to make 'silly' videos and pretend it isn't a large corporation out for the money so get out there and buy a card and watch a large company ship 'quirky' tweets and jokes down your throat ,0,Sep-21
0, amd releases big navi next day nvidia our 3070 is priced lower than big navi next day amd we have lowered the price of big navi me go on continue ,0,Sep-20
1, here you go another reason for me to never buy super fresh inovative products like the new nvidia cards ill will never be cheated again like i was with my s20 ultra ,0,Sep-20
0, the price increase because of taxes is basically what most people overseas like here face gpus are literally double their american msrp counterparts ,0,Jan-21
0, smartie nvidia exec 'so hey we can't make enough of the new stuff so lets divert resources and make more old stuff yuayy ' ,52,Sep-21
1, finally a retailer that's willing to increase the graphics card prices why has it taken this long scalpers will stop scalping if they can't make money doing it ,0,Feb-21
2, and to think i was going to shop nvidia for my next computer thanks for making my decision morally simple d ,3,Dec-20
1, it's stupid enough to buy one of the 3k series cards from a scalper but you're a special kind of stupid if you buy an amd card marked up to the same price ,0,Nov-20
2, who doesnt make sure a website is legit before purchasing a graphics card youre purchasing a graphics card if youre purchasing it to build a pc yourself you probably dont even know how to build a pc ,0,Aug-21
1, lets hope that btc value dropped to nothing and the miners have their gpu mines burnt down at the same time ,0,Dec-20
2, sadly the rx 570 and 580 are still super cheap even brand new and often come with free games or deals etc you can also pick up used gpus for a fantastic deal sometimes but basically the fact that the rx 5500 is being compared to the gtx 1650 and not 1660 that means it won't be very powerful good for an itx gpu perhaps though there are other alternatives such as an itx 1660 amd already have fantastic budget 1080p cards such as the 580 or even 590 but it would be cool if they made alternatives to that category still cool though hopefully they release good quality itx cards and low profile ones it's sad that amd don't have any low profile cards besides a 560 perhaps ,0,Oct-19
0, did they ever fix the whole problems with the drivers for 5series cards not working with dp as all i get when using dp is it shows the post screen then says no signal lol ddu does nothing neither does a fresh install if the os install's any driver for video after a fresh install the screen will go black only works on dp if there's no video drivers ,0,Sep-21
2, team red or team green i don't really care at this point it is just who can get a new gpu in my hands first get's my money ,0,Nov-20
1, please stop praising the nvidia limiter bs nvidia is only doing this so they can sell the cmp with probably 100 mark up and than sell us gamers the gamer version too nvidia has no interest in our well being all they care is making more money another reason for the limiter is to lower the used market that flourishes when miners sell the used old cards ,0,Apr-21
0, maybe if they started selling those gpus they wouldn't be stuck with them it's june 2018 and gtx 1080 tis are still sold out everywhere ,0,Jun-18
0, isn't exynos getting amd gpu architecure i mean i know its a ways off but idfk great job madison btw ,1,Feb-21
1, i really really do not understand why nvidia is pushing 16 series video cards instead of 2050s it dramatically slows rtx adoption ,0,Apr-19
0, and a good one too i had 2 of their hd 4850 golden sample in crossfire those cards were absolute fire ,0,Aug-20
0, why do they have to have permission to stream these games if i buy a full version of the game for normal pc why do they have the option for me to not stream it its not like they would or wouldn't make money form this i can understand if nvidia was selling through something like stadia but i don't see how blizzard activision can do something like this ,0,Feb-20
0, soon enough amd is going to kill it with their gpus they have been doing good with the mid range to low but were lacking in high end ones 800 1200 for a gpu is ridiculous 16 11 2019 03 52 ,0,Nov-19
2, nvidia is on a roll nvidia is on a roll nvidia is on a fucking roll let's talk about the f cking 99 of people who paid for a gpu and still haven't gotten anything after weeks and don't even know when they're getting it ,1,Oct-20
0, man i was gonna buy an nvidia card because of all the stuff they do for 3d simulations and bringing real time ray tracing to the mainstream but amd is making that really difficult right now ,0,Oct-20
2, they need to put more regulations and restrictions on the amount of graphics cards you can buy so bots and bitcoin miners can't keep on buying them out all the time scalpers should also be fined if they are scalping things like gpu's that are 100 150 extra than the regular original price ,0,Mar-21
1, that's a suuper wrong title amd said from the beginning that the radeon vii has limited availability and they also confirmed more gpus ,3,Jul-19
2, according to leaks this card should be around 130 usd at retail which would make it the legend of price to performance ,0,Oct-19
2, cool ordering an rtx super laptop of course if it is more value than a ti one now this will be all to do with my monetary status at the time very cool i can't wait right us gamers are getting spoiled ,0,Mar-20
1, fric frak nvidia i hate them still gonna buy one lol but in all seriousness they need to do better i hope this behavior hurts their pocket ,0,Dec-20
1, steve burning gigabyte love his work put fire under their arse these companies really think we all clones and puppets to sell us shit the blows everything in the pc wait will rma you a new one yes please but the old psu blew my motherboard and gpu can you rma that to since your psu blew up my hardware ,0,Aug-21
0, so this could be interesting i have evga 3080 and when i remove fps limit in any game my gpu triggers some kind of bsod so this could be evga's problem ,2,Jul-21
0, why didn't nvidia fix the fact that aibs made their cards worse than the founder's edition even though asus managed to make their tuf as good as nvidia ,3,Sep-20
0, the gt1010 would be great for a diy server when i don't care about the best graphics but the option is there if needed or if there's some light gpu work possible ,0,Jan-21
0, radeon vii discontinued already wow hope support isnt im looking at amd for my next build but crap like this has me hesitate to do it ,0,Jul-19
