LABEL,text,like,published_month
0, the new top connector looks to be the nvlink system hopefully its enabled the way i understand it based on the gv100 cards if it is functional it will allow for shared memory use across multiple cards so in theroy if you have 2 gtx1180 2080 cards each with 16gb of onboard ram you get 32gb of shared card ram over nvlink for rendering and visualization this would be awesome ,0,Aug-18
1, we wouldnt be in as bad of a gpu situation if gpu companies didnt make side cards and focoused on the big 4 ,0,May-21
0, nvidia finally updates their industrial design to make something that doesnt look like epic gamer crap epic g4merz what is this we1rd and wacky d3sign ,0,Jun-20
1, i told both nvidia and amd that im gonna mine so please take all my money and give me the dam card but they didnt trust me wonder how these so called miners convinced nvidia of them mining ,0,Nov-20
0, stop with the there is an 0 in the title it was on purpose because we all know nvidia will screw up do something weird again next time it will be ,0,Jan-21
1, everyone ill buy amd because theyll have a better launch than nvidia amd worse launch than nvidia everyone surprised pikachu face ,15,Nov-20
1, ok nvidia knows by now that if you tell the internet something isn't hack able its will get hacked and then most likely your company will get targeted for hacking because you think your smarter then the internet being that is is just an update they can just roll the gfx cards drivers back or flash a custom bios on to it ,0,Feb-21
2, amd be like let's release a new series right after nvidia at a slightly lower price to see how many people we can scoop up ,0,Sep-18
2, well let me kms rtx 2080 is 900 100 in my country hope this is just the pre order price ,2,Aug-18
2, wtf 300k gpus have been sent back and yet we're still paying over msrp on them ffs just have a fire sale and i'll buy one right now until the 1180 comes out make them available ,195,Jun-18
2, to be fair the fact amd and nvidia keep churning out new cards instead of making a ton of current gen one so the prices stabilise just goes to show how little they give a flying fuck about anything but money ,1,Sep-21
2, i actually was able to find an rtx 3090 in stock on newegg canada for 2600 cad i didn't buy it because i couldn't afford it edit it was a zotac trinity one ,2,Nov-20
2, 30 series just seems to be nvidia trying to figure out how to mass market vaporware on the hardware side ,0,Sep-20
2, if they are re releasing the 2060 do they already have a stock of chips sitting is a warehouse somewhere if not then why reduce the already insufficient production of 30 series chips to make more it is almost like nvidia has their head shoved so far up their rectum that if a good idea hit them in their ass it would give them a concussion and let's face it they aren't fooling anyone with their stab you in the back while cleaning out your wallet marketing approach ,0,Sep-21
1, i swear it's like september is the opposite month for 2020 nvidia amd and now xbox too everything is getting pro consumer all of a sudden ,0,Sep-20
2, url for ray tracing and dlss performance were going to have a look at 1080p and 1440p performance well be comparing the rtx 3060 ti with the 2060 super and the rx 6800 which is currently the cheapest radeon gpu that supports ray tracing though its not a direct competitor for the 3060 ti as we saw before the 3060 ti is 34 faster than the 2060 super in watch dogs legion at 1080p and with ray tracing enabled that margin doesnt change much using ultra quality ray tracing the rtx 3060 ti is 38 faster and 41 faster with medium quality rt by steven walton ,0,Dec-20
0, just give me a card that you can buy in a store i would love to buy a 3070 or 3080 ,0,Aug-21
0, pc cost less huh just a mid tier graphics card alone cost more then a console how long does the average pc gamer keep that around no really honest question here ,0,Feb-19
2, i hope amd keep doing better because it will give them more money to develop their gpu because we want competition ,0,Nov-19
2, 0 games use real ray tracing or rather good ray tracing if u cant see it it's not going to be ray traced and its 1 sample so meh i'd rather have better processing of properly supported graphics ,0,Feb-19
0, nvidia haha cant even make proper drivers vr has been broken flickering issues with games like wow shadow lands use directx 11 nah that is performance downgrade clearing directx shader cache sure but do you really wanna do that before starting up a game every time ,0,Apr-21
0, can it be used for education purposes for teaching teens machine learning at a low cost if so that is great spending 500 bucks for accessing nvidia cuda is out of reach for so many families inequality of education inequality of opportunities ,0,Jan-21
0, your t shirt remembers me the logos on the boxes of the nvidia geforce 9800 gtx symbolizing a number 9 url ,0,Jul-19
0, that thing is fucking sexy not an nvidia man but the outter cooler sexy af shell making me rather hot up in here ,0,Jun-20
0, i find it weird you don't mention that the amd cards come with 2x more ram which is imho more value than rtx or even dlss ,0,Nov-20
0, you have to make your own gpu then cripple it to be at par with a rich organization like nvidia can you ,0,Feb-21
1, joke's on nvidia i am telling you right now with a 100 day payoff period for the 3060 us miners are buying both ,0,Feb-21
0, lol t mobile just sent me a text telling me about that t mobile has determined that unauthorized access to some of your personal data has occurred we have no evidence that your debit credit card information was compromised we take protection of our customers seriously we are taking actions to protect your t mobile account and we recommend that you take action to protect your credit then read more here and a link ,1,Aug-21
1, hey anthony i dare yu to see how the gt1010 card goes with a 4x 16x pci e adapter on a raspberry pi might be the future of gaming ,0,Jan-21
0, i wonder how the i9 10900hk variant of the i9 10900k will perform when that comes out on laptops like the zephyrus duo 15 i really hope that it doesn't suck up too much watts of power as lord knows the zephyrus duo 15 will need all the power it could possibly get with powering powerful specs like the i9 10900hk rtx 2080 super max q and two high end screens ,0,May-20
1, its going to be called a 1160 bec i saw it on ebay about the time the rtx 2080 came out but i dont think that listing was anything ,0,Jan-19
1, so bad enough they already release a card that is 2x money for 10 faster now hey lets release one that's literally pointless for lets guess 400 from scalpers ,0,Aug-21
2, cmp shouldn't be affected by this artificial limitations for mining at least that's what i understood from that nvidia post ,0,Feb-21
0, the cut down xbox is rumoured for 4 teraflops although teraflops is not a good way to measure performance of a gpu in gaming terms 4 teraflops isn't going to provide a good 1440p experience 1080p fine ,0,Jun-20
2, greedy fucking devs people already own the games nvidia is renting you hardware on which to run it that's totally fine ,0,Mar-20
1, i would be so funny if nvidia suddenly whipped up like a million new gpus and all the scalpers will be stuck with their shit ,0,Nov-20
0, it looks like a 2080ti form the side just with an extra fan on top and radeon written on it come on wheres the creativity people ,0,Sep-20
0, only 30 45 fps at 1080p low in some games so this dedicated gpu is competing with the new amd apu's ,0,Nov-20
0, the rtx is garbage and wasted if there's no good textures to make use of it with specularity and normal maps just use a pbr vanilla texture pack and seus ptgi and bam you have a better experience already ,0,Aug-19
2, been saying this months ago all for 400 i've seen the new navi gpus and they give a good 20 boost from the rtx 2070 but the rtx 2080ti struggles at 4k i smell some bowlshit ,0,Jun-19
1, it saddens me this overhype of navi will probably lead to unjustified disappointment by people who misunderstood the architecture i am personally looking forward to it for the price to performance and relatively lower wattage promises but it seems there are now many people expecting navi to blow out all nvidia cards on the cheap which is just an unrealistic expectation looking at amd's gpu past and their current priorities ,1,Jun-20
1, who the fuck need a rtx 2060 with 12gb ram this card will have the same amount of ram like the rtx 3080ti ,0,Sep-21
2, im interested in a navi card to go with my 2600x but i have a gtx 980 1080p 144hz panel i always struggle to find out what mid range card will actually out perform my 980 at 1080p ,0,Oct-19
2, didn't nvidia just launch a cloud platform for deep learning perhaps they're attempting to turn those 300k gpus into something useful ,0,Jun-18
1, stop showing me this stuff i only have had 300 i may or may not have bought an optiplex 990 and a gtx 1650 low profile ,1,Oct-20
0, honestly no devs shouldn't get a cut from geforce now geforce now is using a normal steam install on a server that streams games to other devices the infrastructure is entirely from nvidia and the devs didn't influence it in the slightest not to mention that you have to buy the game on steam so the developer gets the money they chose to charge for the game they have no business charging more money for a service they don't provide themselves ,1,Mar-20
0, do you even need adaptive refresh rate nowadays on nvidia gpus i use fast sync in the nvidia control panel for all games and have 0 tearing with no noticeable latency increase if i lock fps to my monitor's refresh rate 60 as an alternative solution if some game doesn't work with fast sync then tearing becomes a non issue basically 99 of the time unless framerate drops below it too much too often which i can avoid by just turning down settings to have a more consistent fps i feel like all this desperation for getting freesync on nvidia gpus is really dumb because there's solutions already that work perfectly well for gamers with cheaper mid range graphics cards and people who buy 1080 tis are probably rich enough to afford a gsync monitor for higher refresh rate gaming where adaptive sync actually plays it's role ,0,Aug-18
0, i remember playing a cracked version of halo 1 multiplayer on a mac back in 2006 in graphic design class it really took this long to get halo 3 on pc ,0,May-20
2, the 2080ti is the 1080p gaming king all ultra settings dsr on and you have a superior experience to a puny 5500 or just higher fps its a nice budget card but in no way great ,0,Oct-19
1, i thought people werent buying gpus because they are too expensive when they where at msrp they sold instantly like the ones on nividias store couldnt vendors just lower the price back to msrp and sell all those units i dont understand ,0,Jun-18
0, when i saw the volta 2 title in the scrub bar i slammed my head on the wall thinking it was nvidia doing a volta 2 ,0,Feb-21
0, wow that's a lot of money you have invested in some pretty powerful equipment you must develop some amazing stuff nope just gaming oh like games that help you code for the government or cad up specs for new electric cars nope just games where i shoot aliens after i finish my double shift at tmobile i just put it all on my credit card mother of god we're doomed ,0,Jul-19
0, jay just uploaded a fantastic video about the 'poor' performance of the new cards i highly recommend everyone check it out ,0,Aug-18
0, geforce now is not a platform like windows or mac os it is compute as a service we bring the games we already paid for and own and nvidia lets us play it on their virtual pc out of all the people you'd expect a game dev to understand that ,1,Mar-20
1, was the gtx 1080 ti not like 600 msrp those clowns of nvidia think they can demand every price then can imagine ,0,May-21
0, i thought nvidia bought arm in 2018 oh wait sorry i was just thinking of how much turing cost me ,6,Sep-20
2, this is so true zero shortage microcenter told me yesterday that they have a ton of high end nvidia gtx gpus in the back even showed me a pic that arent circulating i asked them due to the shortage what the limit was on their ordering and stocking of 1080s and 1080tis the mountain of green gpu boxes in the back said it all ,0,Jun-18
1, who wants to plan a nvidia factory raid with me it'll be like the area 51 raid but less machine guns and death ,0,May-21
0, my 35 year old radio shack color computer 3 is showing better performance at 256x192 at 2 colors then amd and nvidia's newest video cards because it's on my desk and working and not listed as sold out or priced at the cost of a fully loaded new pc from a scalper ,0,Mar-21
2, if you do the math nvidia would have had to sell anywhere from 115 00 250 00 gpus to miners the lower number is 3090 msrp the higher number is 3080 msrp ,0,Nov-20
0, that's not fair i'm sure you'll be able to play cyberpunk 2077 with raytracing on in full resolution by the time nvidya comes out with a 40 series or the 50 series so obviously hardware unboxed should be hyping 1500 cards that can't handle it now and actually cost 500 ,1,Dec-20
0, its a 150 tdp gpu it better be beating the 1650 lmao the rtx 2060 is a 160w tdp card just so you guys amd fanboys can keep perspective here ,0,Oct-19
0, finally this is what i want a lagged out vr mirror's edge so i can go 0 vomit comet in the first minute thanks nvidia ,0,May-20
1, current gen 3080 10gb vram is more than you would ever need re releasing last gen mid gpu 12gb is a must ,0,Sep-21
0, wiki su and nvidia's co founder and ceo jen hsun huang are said to be cousins but she dismissed it as not true ,0,Jul-19
1, i understand why butt these companies should build 1 great consumer card and be done with it sell it for as cheap they can and innovate the next 3 5 years and bring out a new one that said this market will vanish within the next 5 10 years ,0,Nov-20
0, my hard limit is 400 474 for a rtx3060 that would still be a lot more expensive than 60s cards used to be ,1,Sep-21
0, stopping radeon vii makes kinda sense since it was kinda off in terms of naming and placement as for alexa bot so people move out to get away from parents which nag all day but also wash clothes just to buy something that nags all day and only takes care of buying stuff you pay for ,0,Jul-19
1, the mainstream media is trying to hide that nvidia cards are crashing because of a vengeful ghost sent by lisa su wake up people ,0,Sep-20
1, they are misusing the monopolistic power in the gpu space whats with gamers who want to mine when their card is idle they cant even though they have the hardware id say go amd but they dont have as many features and rtx does indeed look good in many titles now ,0,Apr-21
1, ethereum mining will stop as soon as ethereum is launched and that will be really soon soo don't think it's ethereum miners that went balls out on new gpu's ,0,Nov-20
0, i actually would be willing to buy a brown and tan gpu to match the noctua cooler i plan to buy of this exists in fact i would change all my fans to match the gpu and im actually not joking tbh ,0,Aug-21
0, the reason libra was despised is that it is a crypto in name only sure the transactions are secured cryptographically but the coins are created by a central authority i e it's digital fiat like xrp ,0,Nov-20
0, just make the cards easily compatible with all 120x25 fans stock fans are garbage compared to a 12 pair of arctic p12 pwm s ,0,Aug-21
0, wtf i i live in saudi arabia and i never heard of that any 300 series gpu available in saudi arabia ,0,Nov-20
1, good point made in the video why would nvidia not make millions of graphic cards to mine cryptocurrency themselves instead of selling them ,0,Jun-18
2, shady nvidia gtx 2070 double performance that titan with rtx on but rtx off it's at best a 1080 performance for the price of a 1080ti nvidia go and fuc yourself we probably will not see a rtx mainstream on games untill 2020 ,5,Aug-18
0, am rocking my i5 9600k at ghzt on air u can oc this chip to 5ghzt on air easily waiting for 20 series gpus to drop in price and am waiting for i7 i9 9th series to drop in price after the new series release ,0,May-20
1, who else starting to resent cryptominer gpu hoggers can't buy any gpu for the price it should be or find em in stock ,4,Mar-21
1, let's hope nvidia locks the rest of the crypto mining after the miners but it up and they flood the used market anonymous should put it on everything lol just for like a month or something blockchain is the future and smart contracts could replace the entire government but screw miners ,1,Feb-21
0, bruh i'm still using gtx 650 1gddr5 i don't mind tho because the 2 latest driver frick my game i'm still using driver instead of ,0,Jun-21
0, lmao it's been a year and there's only 5 games with proper rtx support and 2 of them are minecraft and quake ii ,1,Aug-19
1, oh goddammit i don't want it to be like 2017 2018 again hasn't nvidia or amd learned anything from that time now they're going to take our cards sell them at ridiculously high prices and the market is going to be flooded with scalpers again ,0,Nov-20
2, great far as i'm concerned nvidia is finally starting to do the right thing instead of completely separating and insanely segmenting the product stack they are starting to primarily differentiate by memory amount nvlink support etc there are game ready and studio drivers that's the way it should have been from the start god damn it ,0,Oct-20
2, i would really love a new gpu don't get me wrong i appreciate my 1660 super i just wish they were in stock ,0,Feb-21
0, if just it had nvenc then it would be usefull for a lot of people with media centers and such 1660 is still the lowest end card from what i know if you want 4k support ,0,Jan-21
0, what's wrong with nvidia imagine people who knows little to nothing about pcs and now want to choose a graphics card what a mess ,0,Sep-19
0, i was subscribed to r graphicscard and kept seeing kwest posts pop up i knew it was dodgy because people would only give proof it's not a scam because they had their orders locked in and then every so often the owner would chime in and helpfully say no we aren't a scam ,8,Aug-21
2, 4 month after ordering my 3080 my 1070 died so i had to get a alternative so ive got a 3070 just for my 3080 do be delivered 1 day later fuck you nvidia ,0,Jan-21
1, wow so when we needed a gpu they just had them in the closet while people had to pay 3x on ebay wtf nvidia you kinda late to supply the demand and now you are fucked congratulation you played your self ,1,Jun-18
0, i thought the banner there was a graphic for the article rather than an ad for curiositystream and was laughing about how stephen hawking was used to represent 'voice chat recording' ,3,Apr-21
2, too many gpu's my micro center has a 1 per customer limit and they still manage to be out of the high end cards within 2 days of restocking making people wait a week ,2,Jun-18
1, in the midst of the gpu shortage people should know that there will be many scammers taking advantage so please don't be stupid in the pursuit to buy a cheap gpu buy from reputable stores ,0,Aug-21
2, well i am not bying amd for now now because in my country amd radeon vii costs 799 which is almost the same price for rtx 2080 ,0,Feb-19
0, so is the 1650 replacing the 1050 or 1050ti seeing as there also is the 1660ti or is nvidia going to make a 1650ti as well ,1,Apr-19
1, the sheer stupidity of people who will go in lengths to grab a gpu it's not like they'll die without it also do people really buy those worthless airtags ,0,May-21
2, now thanks to those miners you can get super cheap rx580s and gtx 1060s and build yourself a banging 1080p system for reallyy cheap ,0,Nov-19
2, looks at nvidia earnings and it looks like they're doing just fine in this economy yes i find it stupid but they're the one that are rich nvidia smart enough to make money off of stupid people which is still very profitable these days ,0,Aug-21
0, so tonight im enjoying my new 3080 ftw card playing bfv and my teammate typed me a question so suddenly my i9 9900k asus z390 decided no nope you caint answer him or move my w my a my s all my movement gaming keys stopped working so i quit game changed keyboards usb to a different port now it works do usb ports go bad its been gaming for 6 months straight no troubles but only on friday nights it caint be wore out yet that usb port ,0,Apr-21
0, why nvidia didn't fix the capacitor problem oh wait different manufacturers put the cheaper version together not nvidia but they did make the gpu though ,0,Sep-20
2, i would really prefer if useless cryptocurrency wouldn't make a comeback and make it impossible to get a gpu at decent prices again ,0,Nov-20
1, buying gpus just got even harder don't mind me that bought 37 gpus 3060tim 3070 3080 in the past 2 days ,0,Jan-21
1, what nvidia and the stores could have done is just kept selling 3080s even though they had none left once the scalpers realised there was an inexhaustible supply they'd have cancelled their orders freeing up actual cards for people who genuinely want to use one ,0,Sep-20
2, i get that they're probably making these with left over material that wouldn't be used to make their original gpus but i kinda wish they would just be honest about it this isn't going to distract miners they'll have their cake and eat it too with companies doing things like this the least companies could do is be honest as to why they're going down this road you have left over product you know miners will pay an arm and a leg and in bulk too you wanna make money off of left over product stop lying and saying that this is somehow going to distract miners we know they know it's not going to ,0,Mar-21
0, when saudi arabia came out i couldn't stop laughing but then i realized that i live in saudi arabia i cried and the cards are gonna cost insane money ,0,Nov-20
0, if trump gets his tariffs and bitcoins price goes back up video cards will be more valuable than gold buy now or miss out ,0,Jun-18
2, got a new rtx 2060 super on ebay from newegg for 545 in december feel pretty good about that canadian dollars btw ,0,Sep-21
0, that sounds like the same practice what nvidia did with their regular rtx cards downgraded the next model and renamed rebranded them to the lower model and called them super that switch might as well be switch pro that got a downgrade but still being better than regular ,0,Jul-19
0, if you believe 2080ti gets only 30 fps in 1080p is true you are a super idiot ray tracing is for movie realistic graphics not gaming yet ,0,Aug-18
0, hacked is a strong word considering they didnt collect addresses or credit card information or anything like that its just an archive of all the posts ,0,Jan-21
2, take a look at the performance of the rtx 3080 with the pc game doom internal url and greetings from hans of the dutch lowlands nl ,0,Aug-20
2, if true i'm perfectly fine with amd killing radeon vii to release a higher end navi based gpu sooner rather than later obviously they'll want the 5700 5700xt to sell some decent figures first both reference and partner cards i get that i just hope it offers a similar price to performance to power efficiency ratio as it sounds like the 3700x does for gaming it doesn't even need to increase performance over radeon vii let alone reach 2080ti levels the same 1440p performance numbers as radeon vii at a much less power hungry usage than radeon vii or nvidia equivalent gpus is what i'm personally waiting for ,0,Jul-19
1, nvidia up until 20 series i would consider no other card since i couldn't get a 3080 i again got pissed with there over estimating figures and everything they've done i was impressed with amd subtle but truthful launch i decided they deserved my support however i'll remember what they did to hardware unboxed which i only just discovered researching the cards it'll take nvidia several years to earn back my trust now i'm today no longer an nvidia fanboi ,0,Dec-20
1, what this actually sounds like is that nvidia intentionally held back these graphics cards to hike up prices and it backfired ,0,Jun-18
0, i want a card that's high on performance and could care less for eye candy at a good price point is this possible also at whoop edit also 144 fps ,0,Dec-19
1, with the continuing shortages of gpus i'm so glad i have no impulse control and bought a scalped 3090 off ebay last november i did pay two grand us for it but that's only a 33 increase over msrp so all things considered now i didn't get screwed as hard as people are today ,0,Apr-21
0, if the consumers would just tell the companies that we dont care they would fix this bullshit asap there has not been any massive advances in game graphics that require video card updates every year or two any game can run on a 1080 perfectly stop simping for a new waste of money each year and the graphics card makers will do better ,0,Nov-20
0, that radeon is old rescaled down navi the new cards will be on rdna but they are not here so ,0,Jun-19
1, what if nvidia was being cunning with their unhackable marketing so everybody would try to hack it and they could fix the security flaws they glossed over based on all the hacked drivers ,0,Apr-21
2, can't wait to see the next generation of graphics cards hoping the miners don't mess up this generation like they did pascal ,0,Aug-18
0, the fact the 2080 can do real time ray tracing at all even at 30fps is incredible in itself you're game is now rendering graphics in real time meaning things are no longer pre rendered ,0,Aug-18
0, dear amd red invida green eazy fix for this bit mineing issue make a gpu that physically dos not have the hardware that miners use need is not on the pcb an call it gee a gpu derr and that way the bit miners can buy asis cards that are 100 made for bit coin ,0,Mar-21
